commit	val_bpb	memory_gb	status	description
383abb4	2.667000	26.9	keep	baseline (AdamW, default config)
c67ad2a	2.695369	26.9	discard	lower weight decay to 0.1
909dd59	2.588904	26.9	keep	halve total batch size to 2^16
4161af3	2.533728	26.9	keep	increase matrix LR to 0.04
5efc7aa	1.807902	20.7	keep	reduce depth from 8 to 4
3	99.0	0	crash	line 17: 'from prepare import MAX_SEQ_LEN, TIME_BUDGET, Tokenizer, evaluate_bpb,
1	1.188262	9328.2	keep	WEIGHT_DECAY: 0.2 → 0.2428
1	99.0	0	crash	TOTAL_BATCH_SIZE: 2**16 → 16384
2	1.176026	9328.2	keep	WEIGHT_DECAY: 0.2428 → 0.4664
1	1.157991	9328.2	keep	EMBEDDING_LR: 0.6 → 0.9908
